{
  "cv_identity_mode": "data_engineer",
  "dominant_identity": "Data Engineer",
  "hybrid_secondary_identity": null,
  "identity": {"name": "Varun Rout", "headline": "Data Engineer | Python, SQL, Azure and Reliable Data Pipelines", "email": "varun_rout@outlook.com", "phone": "+44 7830 212139", "location": "Birmingham, UK", "linkedin": "https://www.linkedin.com/in/varunrout", "portfolio": "https://varunrout.com", "github": "https://github.com/varunrout"},
  "summary": "",
  "skills": [
    {"category": "Pipeline Engineering", "items": ""},
    {"category": "Data Quality", "items": ""},
    {"category": "Storage and Transformation", "items": ""},
    {"category": "Cloud and Delivery", "items": ""},
    {"category": "Data Products", "items": ""}
  ],
  "experience": [], "projects": [], "education": [], "projects_lead": false
}
